<?xml version="1.0" encoding="utf-8"?>
<Booklet xmlns:xsi="http://www.w3.org/2001/XMLSchema-instance" xsi:noNamespaceSchemaLocation="https://raw.githubusercontent.com/iqb-berlin/testcenter/16.0.0/definitions/vo_Booklet.xsd">
	<Metadata>
		<Id>CY-BkltTsltRestr-3</Id>
		<Label>Test Bklt Configs value-3</Label>
		<Description>Testen der dritte Werte</Description>
	</Metadata>

	<BookletConfig>

		<!--its only important to navigated to the next page if page navibuttons are disabled -->
		<Config key="pagingMode">buttons</Config>

  </BookletConfig>

	<Units>

		<Testlet id="Tslt1" label="Aufgabenblock">
			<Restrictions>
        <TimeMax minutes="2" leave = "forbidden"/>
        <DenyNavigationOnIncomplete presentation="OFF" response="OFF" />
			</Restrictions>
			<Unit id="CY-Unit.Sample-101" label="Aufgabe1" labelshort="1"/>
			<Unit id="CY-Unit.Sample-102" label="Aufgabe2" labelshort="2"/>
		</Testlet>
		
		<Unit id="CY-Unit.Sample-104" label="Endseite" labelshort="3"/>
	</Units>
</Booklet>